{
  "schemaVersion": "1.0",
  "name": "Mapping Ref Skill",
  "description": "inputMap/outputMap이 $ref 문법을 올바르게 사용하는 예시",
  "skillType": "workflow",
  "inputSchema": { "type": "object", "required": ["text"], "properties": { "text": { "type": "string" } } },
  "outputSchema": { "type": "object", "required": ["result"], "properties": { "result": { "type": "string" } } },
  "instructions": { "objective": "테스트", "rules": [] },
  "model": { "mode": "user", "modelId": null, "allowUserOverride": true },
  "capabilities": {
    "webSearch": false, "imageGeneration": false, "codeExecution": false,
    "dataAnalysis": false, "fileAnalysis": false, "knowledgeSearch": false, "mcp": false
  },
  "knowledge": { "mode": "none", "documentIds": [] },
  "execution": {
    "steps": [
      { "id": "step1", "name": "First", "type": "transform", "inputMap": { "text": { "$ref": "input.text" }, "language": "en" } },
      { "id": "step2", "name": "Second", "type": "transform", "inputMap": { "text": { "$ref": "steps.step1.output.text" } } }
    ],
    "outputMap": { "result": { "$ref": "steps.step2.output.text" } }
  },
  "runtime": { "timeoutSec": 30, "retryCount": 1, "maxToolCalls": 0, "maxNestedSkillDepth": 0 },
  "guardrails": [],
  "usageExamples": [],
  "metadata": { "category": "test", "tags": [] }
}
